Question,Answer
Who is performing at Benedum Center on January 2?,['Kansas']
How many years does a suit have to be filed within to recover the tax due and unpaid when a return has been filed but no tax paid?,['3 years']
When was the Playhouse constructed?,['1897']
What is the number of major non-public companies headquartered in the region?,['Several']
"What is the name of the city that Pittsburgh is characterized as the ""northern urban industrial anchor of""?",['Appalachia']
What is the name of the food stand located behind Section 106?,['Sweet Spot']
When did Pittsburgh welcome a series of major film and television productions?,['2017']
What is the name of the exhibition at the Carnegie Science Center?,"['The Science Behind PIXAR', 'Our Fluorinated Fingerprint: Interpreting Patterns of PFAS in Our Environment and Our Bodies']"
When do the 1.5 hour workshops for educators take place?,['Saturday mornings from 10:30 am–12:00 pm']
What is the name of the event series where Entertainment Technology Center and IDeATe students make their project work available for playtesting?,['Playtest Night']
What is the denominator of the City Apportionment percentage if two of the percentage factors are zero?,['1']
What is the amount of decrease in the Supplies category in the 2024 budget?,"['$52,850']"
What is the date of the Workshop for Educators?,"['Saturday, February 22, 2025']"
What is the name of the museum that is renowned for its collections of 19th and 20th century decorative art?,['Carnegie Museum of Art']
What is the name of the CMU Pantry event?,['CMU Pantry Hours']
How many businesses were in East Liberty in 1959?,['575']
Where will the Milwaukee Panthers play at Duquesne Dukes Basketball?,['UPMC Cooper Fieldhouse']
What is the address of the Pittsburgh Symphony Orchestra's facility?,['600 Penn Avenue']
What is the name of the school that was defunct?,['Margaret Morrison Carnegie College']
"What is the name of the university's president mentioned in the article ""CMU President Welcomes Class of 2026+""?",['Jahanian']
What is the title of the 2017 study about the Greater Pittsburgh Jewish Community?,['The 2017 Greater Pittsburgh Jewish Community Study']
What is the amount of the grant for Oliver Bathhouse Windows?,"['100,000']"
What is the name of the first true emoticon developed at Carnegie Mellon?,['Smile or Frowning Face']
What is the percentage of total expenditures in the 2024 Operating Budget represented by the Department of Finance?,['70.40%']
"What is the title of the Pittsburgh Symphony Orchestra's event on December 8, 2024?","['Sparks Fly, Voices Soar: Brahms and Fauré']"
Who won the Pete Rozelle Radio-Television Award in 2007?,['Don Meredith']
Who resigned as orchestra manager in 1906?,['George H. Wilson']
Since what year has the Pittsburgh Riverhounds made the playoffs in the USL Championship?,['2018']
"When did the Amalgamated Association of Iron, Steel and Tin Workers organize a general strike?",['1901']
What is the name of the publication that contains information about Pittsburgh's landmark architecture?,"[""Pittsburgh's Landmark Architecture""]"
What is the rate of the Sports Facility Usage Fee?,['3%']
What time is the Billy the Kid's Steel Town All-Stars performing at The R Bar?,"['Sundays, 7-10 p.m']"
Which country has the second-highest number of Carnegie Mellon University students?,['China']
What is the name of the hospitals in Pittsburgh?,['UPMC Hospitals']
What is the name of the building where the CMU Philharmonic performs?,"['Great Hall, College of Fine Arts']"
"What is the date of the archived document ""Pittsburgh Science of Learning Center""?",['5-Dec-11']
"What is the name of the venue for the Miami Marlins game on June 9, 2025?",['PNC Park']
What type of cookies are necessary for the website to function?,['Strictly Necessary cookies']
What is the venue of the Pittsburgh Symphony Orchestra on March 1?,['Heinz Hall']
"What is the name of the opera that explores the theme of creation, destruction, and letting go?",['Woman with Eyes Closed']
"What is the name of the local peculiarities that have prompted The New York Times to describe Pittsburgh as ""the Galapagos Islands of American dialect""?",['Pittsburghese']
Where does Brahms & Schumann perform on NOV 01 2024?,['Heinz Hall']
What is the position of Antonio Pierce?,['WR']
When was the 1990s turn around in Pittsburgh?,['1990s']
What is the length of the property at the base of Mt. Washington?,['1.6 km']
When does the Holiday Lights Tour take place?,"['Nov 29, 2024 - Jan 1, 2025']"
What is the name of the authority operating under Consent Decree from the EPA to address sewage issues in Pittsburgh?,['Allegheny County Sanitary Authority (ALCOSAN)']
What is the name of the music venue that Jake Shane is performing at?,['Carnegie Music Hall']
What is the venue of the Vegas Golden Knights game on March 9?,['PPG Paints Arena']
Who was the recipient of the Vannevar Bush Award in 2006?,['Raj Reddy']
What replaced the aging Three Rivers Stadium in 2001?,['Heinz Field and PNC Park']
What is the name of the gallery annex of the Carnegie Museum of Art?,['Sarah Scaife Gallery']
In what year did Gulf Oil get bought out?,['1985']
What is the name of the sports league that Pittsburgh Riveters are part of?,['W League']
How many times has the Pitt Panthers women's basketball team qualified for the NCAA tournament?,['4']
What is the name of the gallery for changing exhibitions from the Smithsonian Institution?,['Smithsonian wing']
What is the name of the team that folded in 1994?,['Pittsburgh Phantoms (roller hockey)']
What is the material of the current fence?,"['Concrete and steel', 'Concrete']"
Who is the longtime scout and assistant general manager?,['Tony LaCava']
What is the name of the First-Year Composition Showcase?,['First-Year Composition Showcase']
Who is the owner of the Dallas Mavericks?,['Mark Cuban']
Who or what is being honored by the tribute performance?,['Grateful Dead']
What is the name of the street mentioned in the document as the boundary of the Cultural District?,['Stanwix Street']
When is Pittsburgh Restaurant Week Winter 2025?,['January 13-19']
What is the name of the luxury box at Highmark Stadium?,['On-Field Party Box']
What is the name of the college that is defunct?,['Margaret Morrison Carnegie College']
When did the Pittsburgh Riverhounds start?,['1999']
Who visited with a small French force in 1727?,['Joncaire']
In what year was the Smiley :) emoticon created?,['1982']
What is the phone number of the American Civil Liberties Union?,['412-681-7736']
What is the name of the Steelers radio broadcaster who created the Terrible Towel?,['Myron Cope']
How much did Andrew Carnegie donate for the establishment of organizations that benefit the public?,['$350 million']
When did the Baltimore and Ohio Railroad enter the city?,['1871']
What is the start time for the Little Italy Days Bocce Tournament on Sunday?,['9:00 AM']
How many upcoming events are scheduled for Lil Duval at Pittsburgh Improv?,['5']
Who won the Emmy for Outstanding Guest Actress in a Comedy Series in 2017?,['Judith Light']
"How many lots owned by the City or jointly by the City, County, and Board of Education does the Streets/Park Maintenance section maintain?","['7,600']"
What is the name of the Carnegie Mellon University professor who won the Nobel Prize for Economics?,['Herbert A. Simon']
What is the name of the assistant professor of chemistry who is presenting the Café Scientifique event?,['Carrie McDonough']
At what time is the Hippo Campus event at Stage AE on February 2?,['6:30 PM']
What is the start time of the Men's Basketball Bowdoin VS Carnegie Mellon event?,['12:00 PM EST']
"What percentage of Allegheny County, Pa., water systems have lead detected?",['80%']
What is the name of the agency empowered by Chapters 651-659 of the Pittsburgh City Code to enforce Civil Rights laws?,['Commission on Human Relations']
What is the name of the Pittsburgh neighborhood where Carnegie Mellon University is located?,['Squirrel Hill']
What is the name of the Pittsburgh-based company that produces steel?,['US Steel']
What type of heritage month is being celebrated from May 2 to May 12?,['Asian American and Pacific Islander Heritage Month']
"What is the name of the event on June 4, 2025, at PNC Park?",['Houston Astros at Pittsburgh Pirates']
When was the Riverhounds founded?,['1998']
What is the name of the event featuring Najee?,['Pittsburgh Winery']
How many marked crosswalks does the Signs and Markings Division maintain?,"['10,000']"
Who was the previous director of the Kiltie Band?,['Paul Gerlach']
What is the amount awarded to Regional Asset District for Public Art in the Park?,"['$458,000']"
How often must each operator file returns for the preceding month?,['By the 15th day of each month']
How much money has been raised for the Allegheny Valley School from the Terrible Towel?,['$1.1 million']
Who is the author of the blog?,['Jared B.']
When does Spring 2025 Registration Week start?,['19-Nov']
What is the fee for seniors/military to tour the Steelers Hall of Honor Museum?,['$15']
Who built their fortunes in Pittsburgh?,"['Andrew Carnegie, Henry Clay Frick, Andrew W. Mellon, and Charles M. Schwab']"
What is the price of the New York Jets at Pittsburgh Steelers game tickets?,['$160']
What is the name of the expressway that serves as a downtown expressway between I-279 and I-579?,['Fort Duquesne Boulevard']
How many destinations did Pittsburgh International Airport have in 2000?,['110']
What type of seating is available for shows in the larger Music Hall venue at Thunderbird Café and Music Hall?,['Lower Balcony']
When is the Carnegie Mellon Jazz Orchestra & JIVE-Carnegie Mellon Jazz Choir performance at Carnegie Music Hall?,['15-Apr']
"What is the name of the federal department that funds housing, economic development, and human services needs in neighborhoods with a high concentration of low- to moderate-income households?",['HUD']
What is the budgeted amount for total intergovernmental revenues in 2024?,['$42.0 million']
What is the name of the event that features both booths and carnival rides?,['Midway']
Who led 600 men from Fort Pitt to destroy Seneca villages in 1779?,['Colonel Daniel Brodhead']
What is the budget for the Regular personnel-salaries and wages in 2023?,"['$1,849,695']"
What is the name of the dynamic city being told through the Architecture Archives?,['Pittsburgh']
Who is performing at the Guest Recital on October 21?,['Patricio Cosentino']
How many of the top 25 MSAs saw a depreciation of housing values between 2006 and 2011?,['22']
"Who edited the book ""Women and the Trades""?",['Elizabeth Beardsley Butler']
What is the name of the Pittsburgh neighborhood that was a hub for the city's tech industry?,['The Golden Triangle']
What is the name of the University of Pittsburgh's Repertory Theatre?,['Repertory Theatre']
What is the timeframe for a taxpayer to make an appeal to the Court of Common Pleas of Allegheny County?,['30 days']
What is the name of the building that houses the Squirrel Hill campus?,['Newell Simon Hall']
How many miles across Allegheny County did the new industrial Pittsburgh stretch?,['50']
What is the time zone of the Greater Pittsburgh region?,['Eastern Standard Time']
"Which team will be playing at PPG Paints Arena on March 11, 2025?",['Vegas Golden Knights']
What is the average age of the population in Pittsburgh?,['33']
When did WTAE-TV begin broadcasting?,['1958']
What was the name of the battleground where Major James Grant's unit was annihilated?,"[""Grant's Hill""]"
"What is the name of the article where a resident explains their belief that redevelopment plans are part of ""deconcentration""?",['Public Source']
What is the total expenditures for the Bureau of Fire in fiscal year 2024?,"['$94,253,097']"
When is Armida previewed on WQED-FM 89.3?,"['January 18 and January 24, 2025']"
What is the name of the Pittsburgh Magazine article about Pittsburgh being the new Hollywood?,['Is Pittsburgh The New Hollywood?']
What is the name of the room where Scotty is hosting a weekly event?,"['Room 102, Cohon University Center']"
What is the seating capacity of the Club Cafe?,['125']
Who was the first Secretary of Homeland Security?,['Tom Ridge']
What is the liability of a Responsible Person if the Producer uses trust fund taxes to pay a lawful obligation with direct knowledge of the breach of trust?,['The payee is considered a Responsible Person']
What is the percentage change from the prior year for the Bureau of Emergency Medical Services in 2024?,['-2.50%']
What is the time period for which data supporting the formula used to apportion Taxable Distributions must be maintained for Partners and Self-employed individuals?,['3 years']
What type of tickets are guaranteed at Pittsburgh.events?,['100% guaranteed tickets.']
Who founded Neighborhood Housing Services in 1968?,['Dorothy Mae Richardson']
Who was the director of the Carnegie Museum of Art from 1922-1950?,['Homer Saint-Gaudens']
"Who is the Outstanding Supporting Actress in a Drama Series winner in 1980, 1981, and 1982?",['Nancy Marchand']
What month is being celebrated as National Disability Employment Awareness Month?,['October']
How long is the Spring Carnival weekend?,['4 days']
"What is the name of the concert that showcases Undergraduate and Graduate students in the studios of Nancy Galbraith, R. James Whipple, and Dr. Katherine Pukinskis?",['Fall Composition Studio Concert']
When did Picklesburgh return to Pittsburgh with safety precautions in 2021?,['20-Aug-21']
What was the name of the venue where the Pittsburgh Pirates played from 1925 to 1930?,['Duquesne Gardens']
In what year did Carnegie Mellon University receive $10 million for its Future of Science Initiative?,['2021']
"Who wrote the book The Pittsburgh Steelers: The Official Team History, Updated Edition in 2005?",['Abby Mendelson']
What is the maximum number of cars that could be parked in the parking place?,['(Not specified in the document)\n\nNote that the last pair is incomplete because the document does not specify the maximum number of cars that could be parked in the parking place.']
Who replaced Kenneth Milani as the interim Chairman of the PCT's Board of Trustees in 2012?,['Carolyn Duronio and Chuck Queenan']
What is the name of the festival presented by the PCT in 2007?,['Australia Festival']
What is the name of the opera company's headquarters building?,['George Westinghouse Air Brake Factory']
What is the ranking of Carnegie Mellon University in Bloomberg Businessweek Best Business Schools?,['#18']
What is the title of the book by Wilson published in 1898?,['(Not specified)']
What is the date of the Final Examinations?,['April 28 - May 3']
Who took over as owner of the Pirates in 2007?,['Robert Nutting']
What is the year the building was built?,['1869']
Who is the director of the Carnegie Mellon Guitar Ensemble?,['John Marcinizyn']
When does The Science Behind PIXAR exhibition take place?,"['May 25, 2024 - Jan 5, 2025']"
What is the name of the music venue located under the tasting room of The Original Pittsburgh Winery?,['The Cellar']
Who performs at PPG Paints Arena on December 14?,['Justin Timberlake']
What is the purpose of Performance cookies?,['Counting visits and traffic sources']
How many Firefighter Instructor positions are there in the Bureau of Fire?,['4']
What is the definition of an Exempt Employer?,['Any person that is a Governmental Entity.']
What is the estimated budget for Commission on Human Relations in 2024?,"['748,299']"
Who was awarded the National Academy of Engineering membership in 2017?,['Sridhar Tayur']
"At what time is the event ""Clouds in my Coffee: Music of Joni Mitchell, Carole King & Carly Simon"" on May 9, 2025?",['7:30PM']
What is the name of the department that audits city contracts for specs?,['Accounts Payable.']
What is the name of the law that the Open Records Officer complies with?,['Pennsylvania Right to Know Law']
What time is the event celebrating the 50th anniversary of CMU scheduled at Carnegie Music Hall on November 14?,['8:00 PM']
Who won the Emmy for Individual Achievement in Sound Recording in 1989?,['Kenneth Love']
What is the name of the University of Pittsburgh's library system that provides historic materials?,['University Library System']
What time is the Carnegie Mellon Chamber Series event?,['7:30 - 9:30 p.m.']
What is the name of the month celebrated on April 27?,['Ridván']
Who was Myron Cope's broadcasting partner in his last seven years?,['Tunch Ilkin']
What is the name of the 30th anniversary exhibition at The Warhol?,['KAWS + Warhol']
What types of works are included in the museum's permanent collection?,"['Works on paper, paintings, prints, sculptures, and installations']"
"Who coined the term ""Cleveburgh"" to refer to the cities of Cleveland and Pittsburgh?",['Christopher Briem']
What was the ranking of Steelers' fans in 2008?,['Best in the NFL']
"On what day do the Summer All, Two & Mini-6 Final Grades Due?",['5-Aug-25']
What is the time of the Student Recital : David Song?,['12:00 PM']
"Who is one of the two ""Toolbox Killers"" mentioned in the document?",['Lawrence Bittaker']
"How long has the improv jam ""Friday Nite Improvs"" been performed in the Cathedral of Learning and other locations?",['20 years']
What is the name of the college that Scott Kaufman is affiliated with?,['Dietrich College']
How many women were in the band by 1961?,['11']
"When does the opera ""Tosca"" take place?",['October 5-13']
What is the size of Carnegie Mellon's main campus?,['157.2 acres']
What is the name of the month celebrated on May 1?,['Asian American and Pacific Islander Heritage Month']
What is the amount of intergovernmental revenue for the Pittsburgh Partnership Trust Fund in Fiscal Year 2024?,"['$3,278,594']"
Which neighborhoods have breakfast spots for crepes and hash?,['Oakland Neighborhood']
When is the 5K Banana Run?,['Annual']
What is the name of the complex opened by the PCT in 2003?,['Theater Square']
What is the name of the tradition that involves a fence on campus?,['The Fence']
Which floor of Hunt Library is hosting the exhibition?,['Fourth Floor']
What is the purpose of targeting cookies?,['To show relevant adverts on other sites']
What is the name of the attraction at the historic riverfront site on the south shore of the Monongahela River?,['Station Square']
What is the duration of the Beauty of the Burgh Tour?,['3 hours']
Who are the co-founders of FORE Systems?,"['Francois Bitz, Onat Menzilcioglu, Robert Sansum, and Eric C. Cooper']"
In what year were Cavalleria Rusticana and Pagliacci last performed together by Pittsburgh Opera?,['1996']
"What is the date of the archived document ""BXA Intercollege Degree Programs""?",['31-Jul-16']
What is the condition for a non-residential parking place to be required to install an electro-mechanical device?,['Consistently underreporting gross revenues and tax to the Treasurer']
What is the salary of the Deputy Controller in 2024?,"['$113,897']"
What is the name of the division responsible for all labor negotiations and contract administration for all collective bargaining units representing City employees?,['Labor and Employment']
What is the name of the event that will take place at Heinz Hall on April 26?,['Brahms & Beethoven']
What is the total amount allocated for Swisshelm Park slag heap remediation?,"['$4,000,000']"
What is the name of the Pittsburgh football team that is formed from members of the J.P. Rooneys?,['Pittsburgh Pirates']
What is the name of the university's walking tour page?,['Walking Tour']
What is the name of the comedian guiding the Black & Gold Tour?,['Matt Light']
What is the name of the innovation roadmap being developed for the city in 2014?,['Innovation Roadmap']
What is the name of the campaign that aims to raise funds for Pittsburgh Opera?,"['Monteverdi Society Forever Campaign', 'Forever Campaign']"
What is the address of Thunderbird Café & Music Hall?,"['4053 Butler Street, Pittsburgh Lawrenceville']"
Who created Pennsylvania Act 77 of 1993?,['(Not mentioned)']
What time does the Pittsburgh Symphony Orchestra ticket office open on weekdays?,['10:00 AM']
What time is the Karaoke at Sonny's Tavern?,"['Sundays, 9 p.m.-2:30 a.m. and Sundays, 10 p.m.-2 a.m']"
What is the salary of each Council Member in 2024?,"['$83,571']"
What is the name of the building where the exhibition is held?,['Hunt Library']
What year did the Pittsburgh Yellow Jackets fold?,['1925']
When can flexible scheduling be used for Sunday Night Football?,"[""Weeks 5-10, and in the NFL's discretion during Weeks 11-17.""]"
What is the name of the organization that brought the Rubber Duck sculpture to Pittsburgh?,['PCT.']
When did the Fort Pitt Tunnel open?,['1-Sep']
What is the amount of personnel salaries and wages for the Pittsburgh Partnership Trust Fund in Fiscal Year 2024?,"['$1,251,896']"
What is the value of the annual benefits from Pittsburgh's urban forest?,['$10-$13 million']
"What is the date of the performance of ""Rana Plays Mendelssohn"" at Heinz Hall?",['14-Jun-25']
How many Nobel Prize laureates are among Carnegie Mellon's faculty and alumni?,['21']
In what year did the Pittsburgh Bulls indoor lacrosse team fold?,['1993']
What immigration group came to Pittsburgh in the 1830s?,['Welsh people']
What types of locations are specifically included within the term of “places of amusement”?,"['Cabarets, night clubs, roof gardens, lounges, entertainment stages, music or dancing halls, ball rooms, or other locations offering food or beverages or merchandise along with entertainment or recreation']"
"What is the time of the event ""Carnegie Mellon Guitar Ensemble""?",['8-10 p.m.']
"What is the name of the musical ""Kimberly Akimbo"" playing at Benedum Center on March 4?",['Kimberly Akimbo']
Who represents Pennsylvania's 12th congressional district?,['Summer Lee and Chris Deluzio']
What is the height of the U.S. Steel Tower?,['841 ft']
Who was the Senator from Pennsylvania from 1901-1904 and 1917-1921?,['Philander C. Knox']
When will the Steelers Style 2024 photos be available?,['2024']
"Who won the 1992 Lighting Design award for ""Jelly's Last Jam""?",['Jules Fisher']
What is the amount allocated for PWSA Lead line replacement in 2021?,"['$10,000,000']"
How many runners are in a Buggy race?,['Five']
What was the name of the road built by the British and colonial forces in 1755?,"[""Braddock's Road""]"
What is the amount of health insurance benefits for the Pittsburgh Partnership Trust Fund in Fiscal Year 2024?,"['$171,794']"
"How many days does a taxpayer, Producer, or Responsible Person have to request a Treasurer's Hearing after receiving an assessment notice?",['90']
When did the Donora US Steel Wire mill close?,['1966']
Who is performing at Heinz Hall on June 4?,['Yo-Yo Ma']
What is the GDP of the Greater Pittsburgh region in 2022?,['$181.5 billion']
What time is the event Carnegie Mellon Jazz Orchestra & JIVE-Carnegie Mellon Jazz Choir?,['8 - 10 p.m.']
"Who is the conductor of the opera ""Woman with Eyes Closed"" on April 26, 29, and May 2, 2025?",['Antony Walker']
Who founded the first US steel company?,['Andrew Carnegie']
What is the name of the Renaissance and Baroque Society of Pittsburgh?,['Renaissance and Baroque Society of Pittsburgh']
What is the name of the executive director of The Frick Pittsburgh?,['Elizabeth E. Barker']
What time will the Sunday night game be played in Week 18?,['8:20 PM ET.']
When was the 1944 MLB All-Star Game held in Pittsburgh?,['1944']
What is the date of the event on November 2?,"['Sat, Nov 02, 2024']"
When did construction begin on Immaculate Heart of Mary Church?,['31-Jul']
"When is the opera ""Tosca"" being performed at the Benedum Center?",['October 5-13']
What are the main sources of research funding?,['Federal sources']
Who was the first clerk of Pittsburgh?,['William Troop']
What is the name of the program that the Commission on Human Relations is involved in?,['HUD Fair Housing Program']
What is the fee for Special Events?,['$5.00']
"What is the name of the festival that Picklesburgh was voted the ""best specialty food festival in America"" in?","[""USA Today readers' polls""]"
"Does an employee who earns $10,000 a month and works only in the City from July to December owe the LST?",['Yes.']
What is the name of the opera performance for the 2024-25 season's Student Matinee?,['Madama Butterfly']
What is the date of the 2024 Great Race?,"['Not specified ( likely to be a day in June or July, but exact date not available)']"
When did the Point Park College open?,['1960']
What is the name of the college at Carnegie Mellon University where Lawrence A. Riddle studied in 1976?,['Mellon College of Science']
Where is the UPMC Cooper Fieldhouse located?,"['15282, Pittsburgh, Pennsylvania, US', '15282, Pittsburgh, Pennsylvania']"
What is the name of the choir festival being held on October 27?,['Treble Choir Festival of Western Pennsylvania']
When is the New York Jets at Pittsburgh Steelers game?,['20-Oct-24']
What percentage of the nation's coal was obtained from within 100 miles of Pittsburgh?,['Forty percent']
What is the name of the team playing against the Pittsburgh Pirates on May 25?,['Milwaukee Brewers']
What is the rank of the Port of Pittsburgh in the US?,['20th']
"What is the name of the workshop that introduces Obsidian, a markdown-based note-taking app?",['Advanced Research Note-Taking With Obsidian']
What is the name of the steel company founded by Charles Martin Hall?,['Alcoa']
What is the email address of the Center for Student Diversity and Inclusion?,['csdi @ andrew.cmu.edu']
What was the population of the Urbanized Area in 1950?,"['1,533,000']"
When did the PSO extend Manfred Honeck's contract and elect a new board chair?,['20-Sep-24']
What is the admission fee for the Treble Choir Festival?,['$5']
