Question,Answer
What was the name of the Emmy-nominated program featuring André Previn and the Pittsburgh Symphony Orchestra.,['Previn and the Pittsburgh']
What year did the Pittsburgh Harlequins Rugby Club found?,['1973']
When will the Dover Quartet perform?,['21-Apr-25']
Who is the 2003-2004 director of the College of Fine Arts?,['Lydia Steier']
What was the total revenue of the PCT as of 2010?,['$46 million']
What is the maximum rate allowed by the Municipal Claims and Tax Liens Act for interest?,['Not specified']
When was Mellon Square laid out?,['1955']
"What is the time of the event on March 8, 2025?",['12:00 PM - 01:00 PM']
What are the parking options near the PNC Theatre?,"['Mellon Square Garage, Oliver Garage, Third Avenue Garage, Forbes Garage']"
Who was the first African-American in the U.N. (1950-1953) and NATO (1961-62)?,['Edith S. Sampson']
When is the Peter Pan ballet being performed?,['27-Oct-24']
What is the name of the organization mentioned in the document?,['Pittsburgh Opera']
What was the metropolitan area population increase in Pittsburgh between 2006 and 2011?,['10%']
What is the name of the recreation center and fitness gym operated by the Recreation Programs division?,['Recreation centers and fitness gyms']
What is the maximum period of assessment for deficiency assessments where fraud is found?,['No limit']
What is the name of the conference that moved the location?,['DUG East Conference']
What was the population of the Urbanized Area in 1970?,"['1,846,000']"
What is the amount of the vacancy allowance in fiscal year 2024?,"['-820,761']"
Where is Disney's Beauty and the Beast being performed?,['Byham Theater']
When will the 2024 Piano Sale be held?,['Aug. 22-25']
What is the name of the program offering voter registration assistance?,['CMU Votes']
When does Summer 2025 Registration Opens?,['11-Mar-25']
"What is the name of the master's degree offered by the Human–Computer Interaction Institute in conjunction with the University of Madeira, in Portugal?",['Not specified']
What is the section number that deals with savings clause and severability?,['605']
What is the grade of the Director of Mobility and Infrastructure?,['35G']
When was the National Academy of Public Administration founded?,['1967']
"Who is the artist featured in the article ""Jonathan Borofsky Interview""?",['Jonathan Borofsky']
"What is the name of the award won by Alan Perlis, a pioneer in programming languages?",['Turing Award']
What is the name of the bureau responsible for all of the major capital improvement projects for transportation or mobility infrastructure?,['Project Design and Delivery Bureau']
When did the Western Pennsylvania Hockey League re-establish?,['1907']
What is the name of the department in the School of Computer Science that focuses on computational biology?,['Ray and Stephanie Lane Computational Biology Department']
What is the name of the factory where Pittsburgh Opera produces its events?,['Bitz Opera Factory']
What is the name of the development company mentioned in the Pittsburgh Business Times?,['Oxford Development']
What is the principal amount of the debt service for 3/1/2037 in the Anticipated 2024 Issuance?,"['760,500.00']"
What is the total number of full-time positions in the Department of Public Safety - Bureau of Administration in 2024?,['135']
What is the name of the hospital that served the area from 1777 to 1845?,['General Edward Hand Hospital']
When was Stephanie Kwolek a student at Margaret Morrison Carnegie College?,['1946']
What is the name of the venue for the Pittsburgh Symphony Orchestra?,['Heinz Hall']
How many Super Bowls did the Steelers win in a six-year span in the 1970s?,['4']
"What is the name of the organization that is seeking volunteers to work tables and seminars, make bird toys, fundraising and more?",['Pittsburgh Parrot Rescue']
What is the number of elected members of the Association of American Universities?,['66']
What is the number of years the Complete Streets Advisory Group (CSAG) was on hiatus?,['4']
What is the catchphrase of the Terrible Towel?,"['The Terrible Towel is poised to strike, and so are The Steelers.']"
What is the name of the University Libraries' exhibit about life on campus in the 1980s?,"['Like, Totally Transformative: CMU in the 1980s', 'Like, Totally Transformative']"
What is the spirit of Pittsburgh that users will experience in June 2025?,['Dynamic and vibrant']
When was the Architecture Archives founded?,"['Not specified in the document, but the exhibition is celebrating its 40th anniversary.', '40 years ago', '1983']"
When does Samuel Comroe perform at Clearview Arena?,['NOV 01 2024']
What is the number of City employees who receive paychecks from the Payroll Office?,"['3,400']"
"Who won the award for Actor (Musical) for the musical ""Kinky Boots""?",['Billy Porter']
What is the name of the organization that offers matching gift program?,['Matching Gift Program']
What is the location of the Pittsburgh Opera?,['2425 Liberty Ave.']
What did the Pittsburgh Hornets win in 1955?,['F. G. `` Teddy `` Oke Trophy and Calder Cup']
What is the address of Burning Bridges Comedy Club?,"['4207 Butler St, Pittsburgh Lawrenceville']"
What is the name of the group that encourages democratic engagement events throughout the year?,['CMU Votes']
What is the name of the city where the Carnegie Museum of Natural History is located?,['Pittsburgh']
In what year did the Pittsburgh Forge relocate to Toledo?,['2004']
What is the phone number of the Pittsburgh Symphony Orchestra's box office?,['412-392-4900']
What is the revenue for Recertification in 2024?,"['640,306']"
What is the Redevelopment Assistance Capital Program funding for Homewood Park?,"['1,000,000']"
How many full-time permanent positions are allocated to the Office of Municipal Investigations in fiscal year 2024?,['8']
What is the amount of funding for the City - Operating Eliminate the anticipated workforce reduction?,"['$112,938,391']"
What is the name of the division that works to accomplish the overall safety of City employees?,['Employee Safety and Injury Prevention']
What was the yearly river traffic in Pittsburgh in excess of in the early 20th century?,['9M tons']
What is the percentage change in expenditures for the Citizen Police Review Board from the prior year in 2023?,['2.30%']
What is the name of the festivals in Pittsburgh?,['Film Festivals']
What is the address of City Winery?,['1627 Smallman St.']
When is the Tartan Men's Basketball team playing Dickinson?,['6-Jan']
When was the alma mater of Carnegie Mellon University written?,['1924']
At what time is Nick Swardson performing at Carnegie of Homestead Music Hall on November 24?,['7:00 PM']
What is the area of the neighborhood that was demolished and replaced with garden apartments in East Liberty?,['125 acres']
When was the first all-African-American opera company in the United States founded?,['1936']
Who was the founder of Xerox PARC?,['George Pake']
What is the name of the oldest continuous club in the U.S.?,['Foxburg Country Club']
What is the name of the free resource that combats food insecurity by providing food assistance to CMU students and their dependents?,['CMU Pantry']
What was established in Schenley Park?,['Schenley Park']
"What is the date of the archived document ""BXA Intercollege Degree Programs – BHA Program""?",['7-Feb-18']
What are the names of the two joint neighborhoods located Downtown along the Allegheny River?,['Lawrenceville and The Strip District']
Who was the first female Allegheny County Commissioner?,['Barbara Hafer']
Who is the World Champion of Magic?,['Miguel Muñoz']
What was the name of the neighborhood where Pittsburgh's wealthiest industrialists lived in the 19th century?,['East Liberty']
What is the name of the stadium where the Pittsburgh Steelers play?,"['Three Rivers Stadium', 'Acrisure Stadium']"
"What is the name of the tour that will be performing at Pittsburgh Improv on February 28, 2025?",['Elevation Nights Tour']
In what year was Lynn Beckstrom a director of the College of Fine Arts?,['1973']
What is the name of the city that the Architecture Archives tells part of the story of?,['Pittsburgh']
What sports does Carnegie Mellon University offer in its intramurals?,"['Wiffle ball, dodgeball, basketball, flag football, ultimate frisbee']"
What is the total expenditures for the City of Pittsburgh in fiscal year 2024?,"['$684,553,037']"
What is the tax rate as measured by gross receipts derived from all service transactions?,['Six mills']
When does the fall season celebration take place?,['9-Oct']
What is the name of the festival that celebrates the 50th anniversary of CMU?,['None (no specific festival mentioned)']
Who was the conductor of the Pittsburgh Symphony Orchestra from 1981 to 1996?,['André Previn']
When did Allen Newell pass away?,['* (Denotes faculty/alumni who are deceased)']
Who is the Director of Carnegie Mellon Jazz Orchestra?,['Mark Snyder']
What is the name of the foundation established in 1951?,['Laurel Foundation']
Who is the President of the Board of Directors of Pittsburgh Opera?,"['(Not specified in the document)', '(Not specified)']"
What is the name of the multicultural academy dedicated to the preservation and presentation of folk songs and dance?,['Duquesne University Tamburitzans']
What is the name of the exhibition at the University Libraries?,['Here to Stay']
When is the Student Recital of Emily Garcia?,['12-Apr']
In what year did British Forces regain the area and establish Fort Pitt?,['1758']
What is the duration of basic training for new recruits in the Pittsburgh Bureau of Fire?,['32 weeks']
What is the name of the venue hosting the Harry Potter and the Order of the Phoenix concert?,['Heinz Hall']
What is the total full-time permanent positions (DPR) in 2023?,['12']
Who set the all-time record for drinking a quart of pickle juice at Picklesburgh?,['Jalen Franko']
What is the name of the largest collection of dinosaurs in the document?,"[""World's largest collection of dinosaurs""]"
What is the location of the CMU Pantry event?,['CMU']
What is the name of the escape room in Greensburg?,['Spellbound Escape Room']
What is the final score of the men's soccer match between Carnegie Mellon and Emory?,['Not provided in the document']
What is the total expenditure for personnel-employee benefits in 2024 for the Department of Parks & Recreation?,"['$887,041']"
How many exhibitions does the museum host annually?,['Up to 15']
What is the location of Pittsburgh Opera's headquarters?,"[""2425 Liberty Avenue, in Pittsburgh's Strip District"", '2425 Liberty Avenue']"
"When was Westmoreland County, Pennsylvania founded?",['1773']
Who does the Treasurer reserve the right to make spot checks of returns filed to?,['The operator/agent']
Who donated the library and the buildings to the Carnegie Museums of Pittsburgh?,['Andrew Carnegie']
What is the title of Myron Cope's book about the early days of Pro Football?,['The Game that was']
What was the name of the gas explosion that occurred in Pittsburgh in 1928?,['Damaging Gas Explosion']
What is the name of the organization that the Bureau assists in tracking the rabies virus?,['Pennsylvania Game Commission']
What is the ranking of Pittsburgh among large cities for commuting without cars?,['Eighth']
What is the increase in personnel-salary & wages from 2023 to 2024 for the Department of Parks & Recreation?,"['$37,597']"
When is The Nutcracker ballet taking place?,['DEC']
What is the date of the event at PPG Paints Arena?,['27-Feb-25']
What is the name of the tour that explores the financial and cultural district?,['Beauty of the Burgh Tour']
What is the name of the esports franchise in Pittsburgh?,['Pittsburgh Knights']
When was Carlow University founded?,['1929']
"When was the Pittsburgh Business Times article ""SPC considers 10-county transit system"" published?",['2-Dec-16']
What is the name of the season sponsor of Pittsburgh Musical Theater's 24/25 season?,['West End Off-Broadway Experience']
What time will the Steelers' game against the Dallas Cowboys start?,['8:20 p.m.']
What is the name of the arena mentioned in the application?,"['PPG Arena\n\nUnfortunately, the document does not provide enough information to find more question and answer pairs.']"
What is the ranking of Carnegie Mellon University's Tepper School of Business by Bloomberg Businessweek in 2024?,['9th']
What was the name of the redevelopment project in downtown Pittsburgh led by John P. Robin?,['Not mentioned']
What is the projected ending balance of the Special Summer Food Service program in 2024?,"['($18,559)']"
When was the Pittsburgh Symphony Radio program launched?,['1982']
What type of glass will be given to the first 100 people to spend $100 at Stillhouse Mobile Hub?,['Customized rocks glass']
What is the percentage of salary increase for FAPP members in the 2024 budget?,['0%']
What is the fee for a child between 3-18 years old to visit the museum?,['$15']
Who was the conductor of the Pittsburgh Symphony at the time of the Heinz Hall reconstruction?,['William Steinberg']
What is the rate of interest on the Local Services Tax?,['12%']
When will Pittsburgh Opera's 2024 Piano Sale be held?,['Aug. 22-25']
What is the name of the global alliance of technological universities that Carnegie Mellon University is a part of?,['Global Alliance of Technological Universities']
What is the name of the Steelers' official ticket-trading site?,['Steelers Ticket Exchange']
What is the total net salary for full-time positions in the Bureau of Emergency Medical Services in 2023?,"['$15,360,056']"
What is the contact number for the Senator John Heinz History Center?,['412-454-6412']
What is the total allocation received by the City of Pittsburgh from the Coronavirus State and Local Fiscal Recovery Fund?,"['$335,070,222']"
What is the current men's record of Sweepstakes?,['02:02.2']
What is the name of the archive featured in the new gallery reinstallation at Carnegie Museum of Art?,"[""Charles 'Teenie' Harris Archive""]"
What is the name of the Carnegie Museum of Natural History's venue?,[nan]
"Who is the electronic music artist who credits Hot Mass with her ""indoctrination into nightlife""?",['Yaeji']
How many Assistant Chiefs are there in the Department of Public Safety Bureau of Fire?,['2']
Where is the 17th International Exhibition of Botanical Art & Illustration held?,['Hunt Institute for Botanical Documentation']
What is the name of the collaboration between Carnegie Mellon and the University of Pittsburgh?,['Center for Neural Basis of Cognition']
Who is required to hold a Valet parking license from the Director of Mobility and Infrastructure?,['Any provider of Valet Parking Services']
When is Tosca performed at Benedum Center?,['October 5-13']
What is the name of the exhibit showcasing life on campus in the 1980s?,"['Like, Totally Transformative: CMU in the 1980s', 'Like, Totally Transformative']"
What is the name of the company that Chatham University is preparing for its first coed undergraduate class?,['Chatham University']
When was The Frick Pittsburgh established?,['1990']
How many years has the Pittsburgh Riverhounds made the playoffs in the USL Championship?,['Four years running']
What is the total amount of non-personnel related expenditures in fiscal year 2024?,"['$181,652,712']"
What is the name of the theater series for families?,"[""EQT Bridge Theater Series and Citizens Bank Children's Theater Series""]"
What is the name of the newspaper that published an obituary for Myron Cope?,['New York Times']
"What is the name of the initiative that focuses on the development and delivery of technology-focused programs, coding, and other tech-adjacent learning initiatives?",['Rec2Tech']
What is the responsibility of OMB upon adoption of the Operating and Capital Budgets?,"[""Implementing and overseeing the City's Operating and Capital Budgets""]"
What year did the PSO announce the discontinuation of its chamber orchestra series?,['2009']
What is the name of the event where the King takes to the track?,['Home game']
What is the record high temperature in Pittsburgh?,['103 °F (39 °C)']
What is the name of the writer's workshop that includes Barton Paul Levenson?,['Write or Die']
Who was the first European to enter the Pittsburgh region?,['Robert de La Salle']
How many of these enterprise zones are located in the City of Pittsburgh?,['17']
"What is the salary of the Senior Manager, Digital Services/Chief Data Officer in fiscal year 2024?","['$95,697']"
What is the percentage change from the prior year in 2023?,['1.80%']
What is the population of the Urbanized Area of Pittsburgh in 2010?,"['1,733,853']"
What is the name of the coach who was named to the NABC All-District 7 Team?,['Allen']
What is the name of the conference where Carnegie Mellon University's women's golf team placed third?,['Tartan Invitational']
Which team will perform at PPG Paints Arena on February 22?,['Washington Capitals']
"What is the approximate year when the area was home to numerous Native American groups, including the Lenape and Seneca tribes?","['17,000 BCE']"
What is the name of the event where Lang Lang will perform on March 19?,['Lang Lang']
Who became the mayor of Pittsburgh in 1994?,"['Thomas J. Murphy, Jr.']"
How many full-time positions are in the Community Development Trust Fund in 2023?,['12']
What is the increase in Personnel-Salaries & Wages from 2023 to 2024?,"['161,213']"
When is the Regular Decision Deadline?,['2-Jan']
Who is the recipient of the 2013 Rhodes Scholarship?,['Courtney Wittekind']
What is the name of the museum that speaks to Pittsburgh's history as an early-20th-century industrial capital?,['Carnegie Museum of Natural History']
When did the Pittsburgh Intergovernmental Cooperation Authority form?,['2004']
When was the Fort Pitt Bridge opened?,['1959']
What is the name of the organization that helps with vendor recruitment?,['Pittsburgh Hispanic Development Corporation']
When is the 17th International Exhibition of Botanical Art & Illustration open?,"['M-F (to Dec 17)', 'December 2 to December 17']"
How many championships did the University of Pittsburgh Panthers win?,['9']
How long can a person be imprisoned for willfully failing or refusing to file a return required by the Institution and Service Privilege Tax Ordinance?,['30 days']
What is the name of the poet who received his MFA from the University of Pittsburgh?,['Terrance Hayes']
When does the MJ musical premiere at the Benedum Center?,['19-Nov-24']
What is the name of the university that the Architecture Archives is a part of?,['Carnegie Mellon University']
What year did the Pittsburgh Pirates play at Three Rivers Stadium?,['1970-2000']
What is the name of the Pittsburgh neighborhood that was a hub for the city's German community?,['Squirrel Hill']
When is the CMU Chorus & Singers performance?,['20-Mar']
What was the name of the program established by Andrew Carnegie to establish libraries in numerous cities and towns?,['Carnegie Library']
What was the name of Myron Cope's autobiography?,['Double Yoi!']
What time will the second game be played on Saturday in Week 18?,['8:15 PM ET.']
What new pickle flavors did Heinz debut at Picklesburgh 2016?,['First new pickle flavors in over 50 years']
What is the fiscal year in which the Office of Management and Budget shall recalculate the amount of dollars approved as “Lost Revenue” funds for the third time?,['2024']
In what year did UPMC announce a $250 million expansion?,['1980']
Who is performing at the Guest Recital by Patricio Cosentino?,"['Patricio Cosentino, Craig Knox, Vahan Sargsyan']"
What is the amount of the vacancy allowance in 2024?,"['$98,786']"
What is the name of the fund used to fund construction and/or maintenance of public property?,['Capital Projects Fund']
What is the name of the conservatory in the East End?,['Phipps Conservatory']
When was the Institutions of Purely Public Charity Act passed?,['26-Nov-97']
Who won the USLC Coach of the Year award in 2023?,['Bob Lilley']
Who is the singer and songwriter of the political punk rock band Anti-Flag?,['Justin Sane']
How many artworks are included in the 17th International Exhibition of Botanical Art & Illustration?,['43']
What is the name of the botanical garden in Oakland?,['Phipps Conservatory']
When is the 2024 Pittsburgh Taco Festival taking place?,"['September 14th, 2024']"
What is the total expenditure for the Office of Municipal Investigations in 2024?,['Not provided in the document']
What does Pittsburgh Opera celebrate in 2023?,['Mary Cardwell Dawson and Black Opera in Pittsburgh']
What is the time of the event on November 15?,['Not specified']
Who won the Outstanding Talk Show award in 1983 and 2001 and 2002?,"[""Rosie O'Donnell and Daniel Orlandi""]"
What is the contact number for Treasure House Fashions?,['412-979-1534']
When did the Gateway Clipper Fleet begin operations?,['1958']
What is the fiscal year budget for the Tax Compliance Division?,"['$107,000']"
When was the Pittsburgh Newspaper Strike?,['1992']
"What is the topic of the seminar series ""Swartz Center for Entrepreneurship CONNECTS""?",['Innovation and entrepreneurship']
What is the revenue for Wilkinsburg Fire Services in 2024?,"['2,219,778']"
Who is the oboist of the Akropolis Reed Quintet?,['Tim Gocklin']
What is the name of the energy trade show hosted in Pittsburgh since 2009?,['DUG East']
What is the name of the magazine where Grinder published his article?,['Western Pennsylvania Historical Magazine']
When do final grades need to be submitted?,"['18-Dec', 'by']"
What is the year that Pittsburgh Opera presents two modern operas in May?,"['Not specified (but implied to be 2023, given the context)']"
What is the name of the trust fund established from an endowment from Henry Clay Frick in 1926?,['Frick Park Trust Fund']
Who is the Principal Pops Conductor of the Pittsburgh Symphony Orchestra?,['Byron Stripling']
What percentage of the City of Pittsburgh Operating Budget is allocated to grants in 2024?,['52.70%']
When did the Pittsburgh Penguins win their third Stanley Cup?,"['June 12,']"
"Who are the authors of the book ""Play On""?",['Hax McCullough and Mary Brignano']
Which Pittsburgh area team won the U.S. Open Cup in its earlier years?,['Gallatin and Morgan Strasser']
What is the name of the team playing against the Pittsburgh Pirates on May 19?,['Cincinnati Reds']
In what year was Pittsburgh founded?,['Not mentioned']
What areas does the Commission on Human Relations receive and investigate complaints of discrimination in?,"['Housing, employment, and public accommodations']"
What is the name of the theatre jam session being held on October 27?,['Spotlight: Monthly LGTBQ+ Theatre Jam Session']
What is the time of the Carnegie Mellon Contemporary Ensemble on January 25?,['8:00 PM']
When was the Pittsburgh mayoral special election held in 2007?,['6-Nov']
What is the name of the company that is headquartered in Pittsburgh?,"['FedEx Ground', 'Respironics']"
"Who is the artist behind the song ""Black and Yellow""?",['Wiz Khalifa']
What is the deadline for Regular Decision at Carnegie Mellon University?,['2-Jan']
What was the total production value of Pittsburgh in 1815?,"['$1,248,000']"
What is the name of the baseball stadium in the North Shore neighborhood?,['PNC Park']
When did Gayety Theater open?,['31-Jul']
What is the name of the fund to which funds appropriated for City of Pittsburgh operating expenses shall be transferred?,['General Fund']
What is the name of the event celebrating the Greater Pittsburgh Community Food Bank on November 9?,['4th Annual Benefit']
What is the name of the tour by Pentatonix?,"[""Hallelujah! It's A Christmas Tour""]"
When was the first ICML conference held in Pittsburgh?,['1980']
When did the Great Depression start?,['1929']
Who are the Steelers visiting in Semana 4?,['Colts']
When was the Pittsburgh Opera established?,['1939']
What is the name of the trust fund established to adjudicate discrimination cases as a certified Fair Employment Practices Agency (FEPA)?,['EEOC Trust Fund']
What is the name of the company that was founded in Pittsburgh?,['Westinghouse Electric Company']
When did the Pittsburgh Victorias cease operations?,['Not specified']
Who is the U.S. Attorney General from 1987 to 1991?,['Dick Thornburgh']
What is the name of the university that the Tartan Men's Basketball team belongs to?,['Carnegie Mellon University']
What was the name of the French commanding officer executed by Seneca chief Tanaghrisson?,['Ensign Joseph Coulon de Jumonville']
Who won the NHL Conn Smythe Trophy in 1991-92?,['Mario Lemieux']
"What is the location of the event Slippery Rock, PA?",['Slippery Rock University Room G9']
Who revised and updated the article most recently?,['Amy Tikkanen']
What award was Charles Geschke awarded in 2008?,['Vannevar Bush Award']
What film was shot at 31st Street Studios?,['The Dark Knight Rises']
When does the chair massage event take place?,['First Friday of every month']
What is the rate of the usage fee?,['3%']
What is the address of the Old Allegheny County Jail Museum?,"['440 Ross Street, Pittsburgh, PA 15219']"
When did the Fort Pitt Bridge open?,['19-Jun-59']
When was the Fort Pitt Tunnel opened?,['1960']
What was the name of the University of Pittsburgh before 1908?,['University of Western Pennsylvania']
How many buildings and structures does the Bureau of Facilities maintain?,['300']
What is the name of the scholarship established by Congress in 1977 to honor President Harry S. Truman?,['Truman Scholarship']
What is the date of the Cleveland Guardians at Pittsburgh Pirates game at PNC Park?,['19-Apr-25']
"In what year did Dan Bobkoff write ""From Steel To Tech, Pittsburgh Transforms Itself""?",['2010']
What is the name of the conference that the 2024-25 Tartan Men's Basketball Schedule is part of?,['UAA']
At what time is the event featuring Montreal Canadiens?,['7:00 PM']
