Question,Answer
"Who wrote the article ""The write stuff""?",['John Hayes']
How many members are in the Pittsburgh Cricket Association?,['Over 250']
What is the maximum penalty for not paying the Local Services Tax?,['50%']
What time is the Men's Cross Country game at the UAA Championships on November 2?,['12:00 p.m.']
What is the total expenditure of the Department of Parks & Recreation in 2025?,"['$5,622,214']"
How many federal jury trials were litigated by the City within a three-month period?,['3']
What is the location of the Carnegie Mellon Jazz Orchestra & JIVE-Carnegie Mellon Jazz Choir event?,"['Kresge Theatre, College of Fine Arts @ 5000 Forbes']"
Who was the British statesman that Pittsburgh is named after?,['William Pitt the Elder']
What university is associated with Duquesne University?,['None (just a mention of the university)']
What is the name of the asteroid named after Myron Cope?,['7835 Myroncope']
When was the Phipps Conservatory and Botanical Gardens founded?,['1893']
When was the Westinghouse Air Brake Company founded?,['1869']
"Who is performing at Stage AE on June 6, 2025?",['Teddy Swims']
What is the percentage change in the personnel-salaries and wages budget from 2023 to 2024?,['2.30%']
Who is the guitarist in the rock bands Winger and Whitesnake?,['Reb Beach']
What year did William D. Magwood IV join Mellon College of Science?,['1982']
What is the name of the artist performing at Stage AE on May 15?,['Warren Zeiders']
Who is the opinion writer and editor?,['Bari Weiss']
"What holiday is being celebrated at Hunt Library, Fourth Floor (other than Kwanzaa)?",['Hanukkah']
When is the 22nd Annual Gingerbread Competition registration deadline?,['10-Nov']
Where is Pittsburgh Opera located?,"['2425 Liberty Ave. Pittsburgh, PA 15222']"
What is the name of the Douglas Education Center in Monessen?,['Douglas Education Center']
When does the Mac & Cheese Festival take place?,['18-May-24']
What is the total revenue for Amusement Tax-Prior Year in 2028?,"['453,045']"
What is the name of the event featuring student composers?,['Carnegie Mellon Philharmonic | Student Composers Concert']
What is the revenue for Returned Check Fee in 2024?,"['6,719']"
How many points does Penguins' Evgeni Malkin have in his career?,"['1,300']"
What is the name of the musical performing at Benedum Center in December?,['MJ The Musical']
What is the name of the company that provides industrial services?,['Centimark']
When was the University of Pittsburgh ranked by U.S. News & World Report?,['2013']
When was the Pittsburgh Open hosted in the city?,['1979-1984']
What is the name of the largest library on Carnegie Mellon's Pittsburgh campus?,['Hunt Library']
What is the name of the center where the Pennsylvania Bridal & Wedding Expo takes place?,['David L. Lawrence Convention Center']
When is the Golfweek Invitational scheduled?,"['Fri, Oct/18 TBA']"
What is the name of the opera being performed from October 5-13?,['Tosca']
What is the revenue for Public Works in 2024?,"['1,726']"
What was the main base for settlers moving into the Northwest Territory?,['Fort Pitt']
What is the expenditure on property in 2025?,"['$19,639']"
What is the population of the city of Pittsburgh?,"['302,971']"
What percentage of the Western Pennsylvania Energy Consortium electricity load will be covered by a renewable wind energy purchase?,['40%']
Who purchased the Bessemer & Lake Erie Railroad in 2004?,['Canadian National Railway']
When was the Pittsburgh Directory for 1815 published?,['1815']
When does Picklesburgh return in 2025?,['July']
When is the Speakers Series: Liz Cheney event?,['16-Oct-24']
What time is the Introduction to Machine Learning With Python workshop?,['3 p.m.']
"What is the deadline for Summer One & Mini-5 add, audit, & tuition adjustment drop?",['16-May-25']
"What is the ISBN of the book ""Artificial Intelligence: Mirrors for the Mind""?",['978-1-60413-059-1\n17.']
Who is the CEO and co-founder of CorePower Magnetics?,['Sam Kernion']
What is the name of the award received by Lauren Schmidt in 2003?,['NCAA Pennsylvania Woman of the Year']
What is the location of the 17th International Exhibition of Botanical Art & Illustration?,"['Hunt Institute for Botanical Documentation', 'Hunt Institute for Botanical Documentation, 5th Fl']"
Who is the recipient of the 2022 Best Adapted Screenplay award?,['Siân Heder']
What is the name of the award Myron Cope won in 2005?,['Rozelle Award']
What is the name of the Steelers' home stadium?,['Acrisure Stadium']
What is the period of time for a suit to begin to recover the tax due and unpaid when the return is fraudulent?,['No limit']
What is the name of the building where Pittsburgh Opera is located?,['Bitz Opera Factory']
When was the first ice hockey game played inside the city?,['30-Dec']
What is the address of The Original Pittsburgh Winery?,['2809 Penn Ave.']
What is the name of the museum complex on Forbes Avenue?,['Carnegie Museums of Art and Natural History']
What is the distance of the 5K Banana Run?,['3.1 miles']
How many District Chiefs are there in the 2024 budget?,['10']
Who is the Governor of Oklahoma from 1921 to 1925?,['E. W. Marland']
How many visitors attended Picklesburgh 2023?,"['200,000']"
In what year was the Gates Cambridge Scholarship program established?,['2000']
What is the name of the Pittsburgh Penguins' arena?,['PPG Paints Arena']
How many floors of gallery and exhibition space does the Andy Warhol Museum have?,['7']
What is the name of the Steelers' home city?,['Pittsburgh']
What is the name of the Pittsburgh neighborhood that was a hub for the city's artists?,['The Strip District']
What is the total number of laborers in the Bureau of Operations?,['160']
What is the address of Braddock’s Rebellion?,"['107 6th St. Pittsburgh, PA 15222']"
What is the name of the Carnegie museum of art?,['Carnegie Museum of Art']
What is the name of the archaeological site operated by the History Center?,['Meadowcroft Rockshelter']
What was the title of Pittsburgh Opera's first world premiere?,['The Summer King']
"How many times did Sonia Manzano win the Emmy for Outstanding Writing in a Children's Series for ""Sesame Street""?",['4']
What is the decrease in expenditures for PERSONNEL-SALARIES & WAGES in the 2023 budget?,"['$82,756']"
What event is mentioned in the document that takes place in Pittsburgh?,['Picklesburgh']
"Where is the exhibition ""Here to Stay: Celebrating 40 Years at the Architecture Archives"" held?","['Hunt Library Gallery', 'Hunt Library, Fourth Floor']"
What is the total expenditure for miscellaneous in 2024?,"['$44,000']"
What is the percentage decrease in the Personnel-Salaries & Wages category in the 2024 budget?,['0.60%']
What is the duration of Pittsburgh Restaurant Week in general?,['Semi-annual']
What is the percentage decrease in the total budget for the Office of the City Controller from 2023 to 2024?,['4.30%']
Who was the Senator from Kentucky from 2011-present?,['Rand Paul']
What is the duration of the opera performance of Tosca?,['October 5-13']
What is the budget line for regular salaries and wages in 2022?,"['$89,556']"
What is the principal amount of the debt service for 3/1/2024?,"['1,239,250.00']"
What is the name of the legislation that authorizes the Treasurer to prescribe regulations?,"['The Local Tax Enabling Act, Act 551 of 1965']"
What is the tax rate in mills per dollar of annual receipts?,['2']
"Who won the Outstanding Production Design for a Variety, Reality or Competition Series award in 2021?",['Eugene Lee']
When did the Pirates play their first National League game?,"['April 30, 1887']"
What is the name of the specialized community for non-binary students?,['Welch House']
What time does the CMU Pantry operate on Monday?,['2 - 5 p.m.']
Who is performing at the Pittsburgh Improv on November 29?,['Karlous Miller']
"Who is the producer of the musical ""The Band's Visit""?",['Musical as producer']
"When did the former sites of the Homestead, Duquesne, and South Side J & L mills get cleared?",['1990s']
Who is the founder of Juniper Networks?,['Pradeep Sindhu']
What type of art is featured in the Treasured Ornament exhibition?,['Islamic Art']
How many events is Kimberly Akimbo performing at Benedum Center in March 2025?,['9']
What is the name of the city where the headquarters of Gulf Oil is located?,['Pittsburgh']
What is the name of the Vice President of Broadway Programming mentioned in the document?,['Marc Fleming']
What is the name of the facility that is a world-class facility for tennis?,['Mellon Park Tennis Center']
What is the total revenue for the City of Pittsburgh in 2028?,"['$728,312,970']"
What is the start time for the Little Italy Days Bocce Tournament on Saturday?,['10:00 AM']
"Where will Chris Porter perform on February 27, 2025?",['PPG Paints Arena']
What is the ranking of Carnegie Mellon University in Environmental Protection Agency Green Power Partnership Top 30 Colleges and Universities?,['#11']
What is the name of the laboratory that EMS can activate prior to arrival for patients experiencing STEMI?,['Cardiac cauterization laboratory.']
What is the name of the artist playing the role of B.F. Pinkerton in the opera?,['Eric Taylor']
What is the annual income threshold for the local service tax?,"['$12,000']"
Who is the recipient of the 1996 Scientific and Engineering Award?,['John Schlag']
What is the increase in the salary of the Arborist-Utility Coordinator?,['$847']
What is the name of the Pittsburgh Post-Gazette article about Pittsburgh being the new Hollywood?,['Is Pittsburgh The New Hollywood?']
What is the name of the largest city park in Pittsburgh?,['Frick Park']
"Who will speak at the Speakers Series on February 19, 2025?",['Adm. James Stavridis']
What is the instrument of the Student Recital : David Song?,['Saxophone']
What is the name of the office that provides events for high school students?,['The Office of Undergraduate Admission']
When is the 2020-2021 PNC Broadway in Pittsburgh Season?,['2020-2021']
What is the title of the Director of Finance or the Department of Finance?,['City Treasurer']
In what year did Carnegie Mellon alumni and faculty receive at least 142 Emmy Awards to date?,['Not specified']
At what time will the Tampa Bay Lightning play at Pittsburgh Penguins?,['7:00 PM']
Who was the first woman to serve as a judge in Pennsylvania?,['Sara Soffel']
What are the two largest subclasses of non-tax revenue in 2024?,['Intergovernmental Revenue and Charges for Services']
What is the name of the competition at Picklesburgh?,['Pickle juice drinking competition']
Where is the LGBTQIA+ Support and Social Group meeting?,"['Hunt Library, Floor 1, Studio A (106B)']"
"Who is the choreographer of the musical ""Chaplin""?",['Dan Kamin']
What is the name of the program offered by Pittsburgh Musical Theater for students aged 13-18?,['Teen Performance Intensive']
Who established the Rhodes Scholarship?,['Cecil Rhodes']
What is the number of new treatments installed to protect bike lanes?,['Not specified']
What is the name of the Steelers' coach?,['Mike Tomlin']
"When was the original on March 27, 2023 archived?",['2023']
What is the name of the character who falls in love with Zelmira?,['Clotarco']
What is the name of the annual sporting event that has been held in Pittsburgh since 1977?,['Three Rivers Regatta']
When is the ITA Cup Preview?,['13-Oct']
"What is the date of the performance of ""Rana Plays Mendelssohn"" at Heinz Hall on the next day?",['15-Jun-25']
When was the Pittsburgh Supercomputing Center established?,['Not specified']
What is the name of the partnership with the Mastercard Foundation?,['$275.7 million partnership']
What is the budgeted amount for total revenues for the licenses and permits category in 2024?,['$17.1 million']
What is the total revenue for the Mellon Park Trust Fund in 2024?,"['$1,511,850']"
"Who is the author of ""A Ground-Up Model for Gun Violence Reduction""?",['T. Rashad Byrdsong']
When is the CMU Chorus & Singers?,['21-Nov']
What is the name of the new hot dog at PNC Park in 2024?,['The Renegade Hot Dog']
What is the name of the monument lighting event in Pittsburgh?,['Monument Lighting']
Who is performing at Stage AE on March 1?,['Ashley Cooke']
"Where is the ""Like, Totally Transformative: CMU in the 1980s"" exhibition held?",['Hunt Library Gallery']
How many Turing Award recipients has Carnegie Mellon University been home to?,['13']
What is the fee for 2 hours parking?,['$2.00']
"Who is the reigning ""Mayor of Picklesburgh""?",['Dan Koba']
What is the name of the artist who created the watercolor on paper of Arisaema ringens?,['Marianne Hazlewood']
When is the Fall Break at Carnegie Mellon University?,['October 15-16']
How many students are enrolled at Franciscan University?,"['2,731']"
What type of vocalist is Max Wittges?,['Bass-baritone']
How often must an operator file returns?,['Each month']
"What is the definition of a ""Tax Year""?",['The twelve-month period from January 1 to December']
Who is not liable for the tax if admitted free?,['Bona fide employees']
Who is the winner of the Outstanding Lead Actor in a Drama Series in 2019?,['Billy Porter']
"What is the title of the position with a 2024 rate of $81,074?",['RAD Program Manager']
What is the location of the Invisible Fight: Chronic Illness Support Group?,"['Well-being Lab (Room 104), First Floor, Highmark C']"
Which company operates commuter service from Butler County?,['Myers Coach Line']
How many full-time permanent positions are there in the Bureau of Operations?,['317']
How many times has Pitt appeared in the Elite Eight?,['1']
What is the name of the oldest course in continuous use in the United States?,['Foxburg Country Club']
"What is the authority responsible for examining the books, papers, and records of any Producer or supposed Producer?",['Treasurer']
What is the name of the event that will take place at PPG Paints Arena on April 18?,['Washington Capitals']
What is the name of the Bureau of Administration?,['The Bureau of Administration']
In what year was Myron Cope inducted into the National Radio Hall of Fame?,['Not specified']
What is the name of the Pittsburgh-based organization that Carnegie Mellon became a partner of in 2015 to leverage data analysis in healthcare?,['Pittsburgh Health Data Alliance']
What time is the Student Recital of David Song?,['12:00 PM']
Where is the PhD Student Support Group held?,"['Kresge Theatre, College of Fine Arts', 'Kresge Theatre']"
What is the name of the volunteer mentioned in the document on Ginny Kasserman's story?,['Ginny Kasserman']
When does the Chicago Cubs at Pittsburgh Pirates event take place?,['30-May']
What is the name of the music hall that will have Blind Pilot on January 27?,['Music Hall at Thunderbird Café &...']
When must City Council adopt the budget?,['Before December 31st.']
What is the program of the Carnegie Mellon Chamber Series on February 24?,"['Anjélica Negrón Marejada, Aftab Darvishi Daughters of Sol, and CMU Honors Quartet']"
In how many games did T.J. Watt record his 100th career sack?,['109']
When will the new City of Pittsburgh website be launched?,['22-Oct-24']
What is the deadline for obligating appropriated funds?,['31-Dec-24']
What is the GDP of Pittsburgh in 2022?,['$153.3 billion']
What is the name of the program that offers free childcare services during performances?,['La Traviata']
What is the duration for filing a suit for collection of taxes when no return was filed?,['No limit']
When is the Washington Capitals game against the Pittsburgh Penguins?,"['Feb 21, 2025, Feb 22, 2025']"
What is the percentage of salary increase for members in the 2024 budget?,['0%']
"When will the ""Justin Timberlake"" event take place?",['14-Dec-24']
Where is the Syracuse Orange at Pittsburgh Panthers Football event held?,['Acrisure Stadium (formerly Heinz Field)']
What is the Redevelopment Assistance Capital Program funding for Jefferson Recreation Center?,"['500,000']"
"Who wrote the book ""Twentieth Century Pittsburgh: Government, Business, and Environmental Change""?","['Lubove, Roy']"
"At what time is the ""December Song Shop"" event?",['12:00 PM - 01:00 PM']
"Who is sometimes called the ""Cradle of Quarterbacks""?",['Pittsburgh']
What year was the first Head of the Ohio Regatta held?,['1987']
Who wrote the Entertainment Weekly article about how Pittsburgh landed 'The Dark Knight Rises'?,['Hillary Busis']
What is the budget for the Department of Public Works in fiscal year 2024?,"['$74,563,534']"
What is the name of the foodie guide written by a college student?,['Feasting Through Pittsburgh']
What is the name of the Steelers' community appreciation party?,['En Casa Con Los Steelers']
What is the name of the event at the Tepper School of Business?,['Meaningful Play 2024']
What is the name of the app implemented for employee wellness in the Bureau of Emergency Medical Services?,['Cordico App']
What is the name of the tax code that the regulated financial institution under is governed by?,['Tax Reform Code of 1971']
What is the total expenditure of the Department of Human Resources and Civil Service in 2028?,"['$53,022,871']"
What is the deadline for a Qualified Managing Entity to register with the Treasurer?,['60 days']
What is the class of 1990-91 apprentice's name?,['Shelley Jammeson']
What is the most densely populated neighborhood outside of the city limits in Pittsburgh?,['Dormont']
What is the name of the baking contest at the festival?,['Great American Banana Baking Contest']
"Who is a conductor, class of 1992-93?",['Patrick Chestnut']
When does the Regular Season Challenge start?,['September 3rd']
Who hit a walk-off home run in the 1960 World Series?,['Bill Mazeroski']
What is the budget for the Workers' Compensation-Settlement in 2024?,"['$80,000']"
What is the name of the street where the Bitz Opera Factory is located?,['Liberty Avenue']
What is the name of the conservatory that appears in Jacoby's films?,['Phipps Conservatory']
Who is the singer and songwriter of the lo-fi musician Weird Paul Petroskey?,['Weird Paul Petroskey']
What is the maximum rate of penalty for unpaid Parking Tax?,['50%']
What is the percentage of the Director's allocation in the Department of Finance?,['85%']
What is the minimum population required for a metropolitan area to be included in the Great Lakes megalopolis?,"['150,000']"
What is the name of the chair held by James Benoit?,['Barbara Weldon Chair']
What is the name of the basketball team playing against Pittsburgh Panthers on March 8?,['Boston College Eagles']
What is the percentage of Asian population in Pittsburgh in 2020?,['5.80%']
What is the name of the speakeasy performance space dedicated to the art of sleight of hand and prestidigitation?,['Liberty Magic']
What is the name of the museum at 440 Ross Street?,['Old Allegheny County Jail Museum']
How many residential buildings are on campus?,['27']
What is the total budget for the Department of Innovation & Performance in 2024?,"['$22,326,860']"
What is the amount awarded to Hillman Foundation for Innovation Road Map?,"['$238,996']"
Who was the music director of the Pittsburgh Symphony from 1938–1948?,['Fritz Reiner']
Who is the quarterback of the Pittsburgh Colts?,['Two strong quarterbacks']
What is the name of the authority responsible for redevelopment in Pittsburgh?,['Urban Redevelopment Authority (URA)']
Where are all the Pittsburgh Symphony Orchestra's productions taking place?,['Heinz Hall']
What is the URL for downloading the Taxpayer Bill of Rights?,['http://apps.pittsburghpa.gov/finance/10_taxpayers_bill_of_rights.pdf']
What were the main industries that Pittsburgh's economy shifted to in the later 20th century?,"['Education, tourism, and services']"
"In what year was the book ""Sandlot Seasons: Sport in Black Pittsburgh"" published?",['1987']
What is the name of a Pittsburgh neighborhood mentioned in the document?,['Green Man']
What is the period of time that records must be preserved by Producers who collect the Amusement Tax?,['3 years']
What is the name of the event at Heinz Hall on February 2?,['Pittsburgh Symphony Orchestra']
When is the Strauss' Alpine Symphony event happening at Heinz Hall?,['17-Nov']
What is the name of the stadium that the Pirates call home?,['PNC Park']
Where is Cold War Kids performing on November 06?,"['Stage AE, 15212, Pittsburgh, PA']"
At what time is the event featuring Najee?,['6:30 PM']
When did Bill Burns anchor at KDKA?,['1953-1989']
What is the name of the Steelers' logo?,['Steelmark logo']
Who is the singer and songwriter of the alternative rock band Girl Talk?,['Gregg Gillis']
What is the name of the museum that houses a collection of art?,['Carnegie Museum of Art']
Who wins the 1948 Negro World Series?,['Homestead Grays']
What is the name of the famous Pittsburgh festival?,['Picklesburgh']
What is the increase in personnel-salaries and wages in the Mellon Park Trust Fund from 2023 to 2024?,"['$4,091']"
What year was Microsoft Research founded?,['1991']
What is the name of the recording label documenting Manfred Honeck's work in Pittsburgh?,['Reference Recordings']
"Can an employee with two part-time jobs, one in the City and another in Municipality ""A"", pay the LST?",['No.']
What is the name of the river that Pittsburgh is situated at the junction of?,['3 rivers']
"What is the name of the theater where the musical ""Evil Dead the Musical"" will be performed from September 27 to October 26, 2024?",['West End Canopy']
What is the name of the music venue that Pink Martini is performing at?,['City Winery Pittsburgh']
How many championship titles has Robert Morris University's football team won?,"['( Not specified in the document, but I can find that the document says ""the football team has won the most championship titles in the conference."")']"
What is the name of the famous football coach?,['Bill Cowher']
Who signed a new contract?,['Pat Freiermuth']
What is the name of the music venue in Pittsburgh?,['Pittsburgh Improv']
"Who co-authored the book ""Off My Chest"" with Jim Brown?",['Myron Cope']
What is the address of Wexford Health Sources?,"['425 Holiday Drive, Foster Plaza Two, Pittsburgh, PA 15220']"
What is the maximum fine for failing to file a return required by the Institution and Service Privilege Tax Ordinance?,['$500.00']
What is the name of the school that receives proceeds from the Terrible Towel?,['Allegheny Valley School']
"Who is the engineer remembered in the article ""Judy Resnik: Family, Friends Remember Engineer Who Reached for the Stars""?",['Judy Resnik']
"Who is the Artist to Watch mentioned in the document on Wed, Dec 11, 2019?",['Dennis Garner']
What was the name of the Pittsburgh Academy that later developed into the University of Pittsburgh?,['Pittsburgh Academy']
"What is the name of the graduate program offered by Carnegie Mellon's Information Networking Institute in Athens, Greece?",['Not specified']
Who still influences Pittsburgh's film industry?,['George Romero']
What is the minimum total earned income and net profits for exemption from the Local Services Tax?,"['$12,000']"
What is the name of the university's publication that reflects on the people and events of 2005-2006?,['The Tartan']
What is the total expenditure for 2023 in the Bureau of Animal Care & Control?,"['$1,904,088']"
When does National Arab American Heritage Month occur?,"['All Day, April 2-7, 2025']"
Who is a Grand Finals Winner of the Metropolitan Opera's Laffont Competition?,['Emily Richter']
How many days does an employer have to file the return and pay the tax after discontinuing business or ceasing operation?,['15']
What is the name of the city where the opera Tosca is being performed?,['Pittsburgh']
What is the total number of Full Time Permanent Positions in the Office of Management & Budget in 2024?,['32']
What is the main source of tax revenue for the City of Pittsburgh?,['Real estate taxes']
What is the name of the historic skyline provider in Pittsburgh?,"[""The History of Pittsburgh's Skyline""]"
What is the name of the university hosting the Carnegie Mellon Opera: Alcina?,['Carnegie Mellon University']
What is the name of the venue that is a repurposed skatepark-turned-music-venue?,['The Funhouse']
What is the name of the authority that carries out many governmental functions in Pittsburgh?,"['Boards, Authorities and Commissions']"
What is the spirit of Pittsburgh in December 2024?,['Dynamic and vibrant.']
What is the name of the 2020 Daytime Emmy-winning series for Outstanding children's programming?,['The Dark Crystal']
What is the name of the Pittsburgh site for buying tickets?,"[""Pittsburgh Symphony Orchestra's official website""]"
Where is the largest collection of casts of architectural wonders on display?,['Carnegie Museums']
What was the population of Pittsburgh in 1820?,"['7,248']"
What is the name of the event that Pittsburgh Opera is hosting in May?,['International opera conference']
What is the name of the event that Scotty is hosting in the room 102?,['Nexus of Civic Engagement']
What is the projected beginning balance of the Parks Tax Trust Fund in 2023?,"['$1,558,434']"
How long can a person be imprisoned for not filing a return required by the Institution and Service Privilege Tax Ordinance?,['30 days']
"When does the exhibition ""Associated Artists of Pittsburgh 110th Annual Exhibition"" end?","['Sun, Jan 12, 2025']"
"How many students, families, and educators participate in Pittsburgh Opera's educational events annually?","['15,000']"
What year was Transarc founded?,['1989']
What is the phone number of the Center for Student Diversity and Inclusion?,['412-268-2150']
What is the total budget for Personnel-Salaries & Wages in 2024?,"['$1,608,004', '$ 7,465,484']"
What was the name of the fort that became a United States fort in 1777?,['Fort Pitt']
"What is the name of the artist who plays the role of ""Genie"" in Disney's Aladdin?",['Trevor Dion Nicholas']
