Question,Answer
How many students are enrolled at the University of Pittsburgh?,"['29,178']"
"Who wrote the article ""Presidential biographer gets presidential medal""?",['Jerome L. Sherman']
What is the name of the intercollege degree program at Carnegie Mellon University?,['BXA']
What was the amount donated by William S. Dietrich II to Carnegie Mellon?,['$265 million']
How many championships did the Pittsburgh Steelers win?,['6']
What is the size of the renovated building?,"['45,000 square feet']"
What is the expenditure for Property Services in 2024?,"['5,000']"
In what year was the book published?,['Not specified']
What is the amount of Workers' Compensation-Fees in 2023?,"['$90,233']"
What is the title of the book by Hax McCullough and Mary Brignano?,['Play On']
What is the current undergraduate mobot course record?,['01:17:10']
What is the tax rate imposed on the privilege of conducting or operating a service or service institution in the City of Pittsburgh?,['Six mills']
What is the name of the college at Carnegie Mellon University where Swati Varshney studied in 2010?,['CMU']
What league did the Pittsburgh Pirates play in from 1925-26 to 1929-1930?,['NHL']
What is the name of the music hall where Sheng Wang will perform on March 6?,['Carnegie of Homestead Music Hall']
Where is Treasure House Fashions located?,"['7607 McKnight Road, Pittsburgh Ross']"
"When is the exhibition ""17th International Exhibition of Botanical Art & Illustration"" taking place?",['To December 17']
What time does the CMU Philharmonic perform?,['Noon - 2 p.m.']
What is the number of spinoff companies created by the CMU community?,['152']
Who are the recipients of the 1988 Daytime Emmy for Outstanding Daytime Drama Series?,"['Jill Farren Phelps, Charlotte Savitz, Julie Hanan Carruthers, Steven Kent,']"
At what time will the Milwaukee Panthers play at Duquesne Dukes Basketball?,['8:00 PM']
What is the name of the High School for Creative and Performing Arts located in the Cultural District?,['High School for Creative and Performing Arts']
When is the Guest Recital by Patricio Cosentino?,['21-Oct']
What is the instrument of the Student Recital : Siyuan Shen?,['Saxophone']
How long is a refund made within 75 days of a refund request or 75 days after the last day the employer is required to remit the local services tax exempt from interest?,['75 days']
What is the name of the popular sandwich shop in Market Square?,"[""Primanti's""]"
What is the address of Stage AE?,"['400 N Shore Dr, Pittsburgh, PA 15212', '400 North Shore Dr.']"
"What is the event ""Theravada New Year"" celebrating?",['The Theravada New Year']
What is the name of the building where the Architecture Archives is located?,['Hunt Library']
What is being celebrated by Pittsburgh Opera in Pittsburgh?,['Mary Cardwell Dawson and Black Opera']
"What is the name of the Resident Artist who performed at Berlin, Paris, and Metropolitan?",['Rolando Villazón']
How many National Academy of Engineering members is Carnegie Mellon home to?,['65']
Who was the Governor of Pennsylvania from 1979-1987?,['Dick Thornburgh']
What is the name of the heavy metal band that was nominated for a Grammy?,['Code Orange']
In what year did the Carnegie Library open in Pittsburgh?,['1890']
What is the launch date of the new City of Pittsburgh website?,['22-Oct-24']
What is the name of the sandwich piled high with fresh deli meats and cheeses at Primanti's?,"[""Primanti's sandwich""]"
What is the name of the video production company?,['The Videohouse']
How many times has Ramayya Krishnan been elected as a Fellow of the American Association for the Advancement of Science?,['2']
What is the name of the company that was involved in Pittsburgh's lead crisis?,"['(Not specified in the provided text, but can be inferred as Duquesne Water Company in the original article)']"
Who is the registered dietitian for the Eating for Energy Workshop?,['Jessica Tones']
What replaced the Homestead Works in 1999?,['The Waterfront shopping mall']
In what year did Myron Cope announce his retirement from broadcasting?,['2005']
What is the name of the organization that defines the Great Lakes megalopolis?,['RPA (Regional Plan Association)']
What is the name of the library and archives at the History Center?,['Detre Library & Archives']
What is the name of the Pittsburgh Symphony Orchestra show on February 08?,['Star Wars Episode IV : A New Hope']
What is the name of the playwright who was born and raised in Pittsburgh?,['August Wilson']
What is the middle 50% range of SAT scores for reading and writing of enrolled freshmen?,['720-770']
What is the name of the law that the Bureau of Animal Care and Control enforces?,['Dangerous Dog Law']
What is the increase in debt service from 2023 to 2024?,"['$4,431,645']"
In what year did the Pirates win their first World Series title?,['1909']
What is the name of the initiative that employed 914 City of Pittsburgh youth in the Summer Learn and Earn program?,['Summer Learn and Earn']
Who won the Outstanding Costume Design for a Variety or Musical Program award in 1976?,['Daniel Orlandi']
When will the Fall Student Choreography Project be held?,['October 23-27']
What is the name of the Duquesne University football contributor who was a pro football pioneer?,['Dave Berry']
What are the dates of the Pittsburgh Opera's 2023 Piano Sale?,['Aug. 24-27']
What is the name of the $75 million brain research initiative at Carnegie Mellon University?,['Brain Research Initiative']
What is the name of the historic village and rockshelter owned by the Heinz History Center?,['Meadowcroft Rockshelter and Historic Village']
What is the name of the space for students across the neurodiverse umbrella?,['Neurospicy']
Who served as the endowed guest conductor of the Pittsburgh Symphony Orchestra from 2005 to 2006.,['Marek Janowski']
What is the year shown in the copyright notice of Carnegie Mellon University?,['2024']
When was the Heinz History Center founded?,"['1996', '1879']"
"What is the topic of the workshop ""Data for Citizen Science and Developing Community Data""?",['Community-based data projects for citizen science use']
"What is the salary of the Chief Accounting Officer, C.P.A in the Office of the City Controller?",['Not specified.']
Who is performing at PPG Paints Arena on November 12?,['Rod Wave']
Who is the current owner of the Carolina Panthers?,['David Tepper']
What is the name of the event celebrating the 40th anniversary of the Architecture Archives at Carnegie Mellon University?,['Here to Stay: Celebrating 40 Years at the Architecture Archives']
What are the hours of the Carnegie Museum of Natural History on Thursday?,['10:00 am – 8:00 pm']
What is the ranking of the Port of Pittsburgh in 2011?,['20th-largest port']
What is the name of the current special exhibition at The Frick Pittsburgh?,['Treasured Ornament']
Who holds the current undergraduate mobot course record?,['Nathaniel Barshay']
"Who wrote the article ""How Yaeji Found Her Voice""?",['Kim Michelle']
What is the name of the activity area for kids at Picklesburgh?,"[""Li'l Gherkins""]"
Who is the winner of the Outstanding Talk Show in 2001 and 2002?,"[""John McDaniel and Rosie O'Donnell""]"
What is the year Make Music Pittsburgh started?,['Not specified in the document']
What is the amount allocated for ARP Trust Fund Maher Duessel contract in 2023?,"['$100,000']"
What is the name of the fund used to account for resources held for the benefit of parties outside the government?,['Fiduciary Funds']
What are the available accommodations for guests with special needs at Fiddlesticks concerts?,"['Family restroom, quiet room, fidgets, and noise-cancelling headphones']"
How many opera companies is Pittsburgh Opera in the United States?,['Seventh-oldest']
What is the name of the newly renovated theater in Pittsburgh?,['Greer Cabaret Theater']
When did Carnegie Mellon University announce a partnership with the Richard King Mellon Foundation?,['Not specified']
What is the hourly rate for a Paramedic with 5 years of experience in 2023?,['$36.3806']
What is the name of the organization that hosts the opera performances?,['Pittsburgh Opera']
What is the capacity of Stage AE?,"['5,000']"
What is the name of the famous baseball player from Pittsburgh?,"['Ken Griffey', 'Tito Francona', 'Stan Musial', 'Doc Medich']"
What is the name of the festival that presents something for everyone?,['Pittsburgh Humanities Festival']
"In what decade did Pittsburgh's economy shift from heavy industry to services, medicine, higher education, tourism, banking, corporate headquarters, and high technology?",['1980s']
What is the fiscal year of the City of Pittsburgh Operating Budget Department of Public Safety - Bureau of Administration?,['Fiscal Year 2024']
What was the starting point for the Lewis and Clark Expedition?,['Pittsburgh']
What is the name of the transit agencies in Pittsburgh?,['Port Authority']
Who is the guest conductor eager to reprise his role as symphony leader in 2003?,['Davis']
What is the maximum imprisonment term for a misdemeanor?,['Not more than one year']
What is the department that manages the Mellon Park Trust Fund?,['Department of Parks and Recreation']
What is the amount of expenditures for Supplies in 2028?,"['$27,050']"
What percentage of Point Park University students are out-of-state?,['21%']
What is the date of the Percussion Studio Recital?,['24-Nov']
How many square feet of property does the Pittsburgh Cultural Trust manage?,['One million']
What is the year of the Strategic Plan 2025?,['2025']
What is the name of the lighting feature at Rivers Casino's Drum Bar?,['80-foot lighting feature']
What is the name of the steel mill that operated in Mon Valley from 1938 to present?,['Mon Valley Works – Irvin Plant']
What is the name of the bar that was made from the bones of the Allentown bar and has original wood paneling?,['Bottlerocket Social Hall']
What is the name of the former B & O line that is now a bike path?,['Grant Street Station']
"What is the location of the exhibition ""Here to Stay: Celebrating 40 Years at the Architecture Archives""?","['Hunt Library, Fourth Floor']"
What is the name of Carnegie Mellon University's research institute that was closed in 2001?,['Carnegie Mellon Research Institute']
What is the fine for a Qualified Managing Entity or Nonresident Contracting Party who negligently or willfully makes any false or untrue statement on the Usage Fee return?,"['Not more than $2,000']"
When was Gordon Bell a faculty member at the School of Computer Science?,['1991']
When did the Allegheny Arsenal explosion occur?,['1862']
When were the Payroll Tax Regulations revised and effective?,['1-Jan-20']
What event in 1812 cut off the supply of British goods?,['War of 1812']
What is the boarding location of the Comedy Bus Tour?,"[""1027 Penn Ave ( near Jimmy John's )""]"
What is the largest payment in the intergovernmental revenues category in 2024?,['State pension aid']
What is the fiscal year in which the Office of Management and Budget shall recalculate the amount of dollars approved as “Lost Revenue” funds?,['2022']
When was the Carnegie Technical Schools established?,['1900']
What is the percentage rate of the Amusement Tax?,['5%']
When was Wilson a student at the opera?,['Class of 2020']
What is the start time of the Penn State Nittany Lions event at Clearview Arena (Formerly RMU Island Sports Center)?,['3:00 PM']
What is the name of the Board of Directors President announced by Pittsburgh Opera?,['(no specific information available)']
What option can you select when ordering tickets at City Winery?,['Have a Bottle of Wine Waiting At Your Table']
What is the name of the concert by the Escher String Quartet?,['Guest Masterclass']
How many positions were reduced by the PSO in 2009?,['9']
What is the percentage decrease in expenditures for the Bureau of Facilities from fiscal year 2023 to 2024?,['31.50%']
What percentage of the admission charge is the imputed Amusement Tax?,['5%']
Who is one of the notable Olympians from the Pittsburgh area?,['Kristi Leskinen']
What is the state where Carnegie Mellon University is located?,['Pennsylvania']
What is the name of the software process model developed by Carnegie Mellon University?,['Capability Maturity Model']
What is the total budget for the Bureau of Operations in 2024?,"['$25,856,409']"
What is the total number of Full-Time Permanent Positions in the Department of Mobility & Infrastructure?,['112']
"What type of performance is ""PSO360: Sheku Kanneh-Mason, cello""?",['Cello']
"What is the name of the division that is responsible for making sure that Pittsburgh's existing buildings and businesses operate in accordance with the Property Maintenance, Business and Trade Licensing, Zoning, and portions of the Fire codes?",['Operations Division']
What is the percentage change in the Expenditures Total for the Three Taxing Bodies Trust Fund in 2024 compared to 2023?,['-23.60%']
What is the name of the school that offers undergraduate programs in Business Administration and Economics?,['Tepper School of Business']
Who is the owner of the Pittsburgh Steelers?,"['The Rooney family', 'Art Rooney']"
"What is the name of the department that inspects and audits engineering, architectural, construction and demolition contracts?",['Office of the City Controller']
What is the level of certification for EMS personnel on the Hazmat Team?,['Technician.']
What is the name of the park at the point where three rivers meet?,['Point State Park']
What is the percentage of allocation for Park Ranger positions from the Regional Asset District - Parks & Recreation Trust Fund?,['40%']
Where is the Sukkot celebration located?,"['Cohon University Center, Main Hallway']"
What is the name of Carnegie Mellon University's global presence initiative?,['Global Presence']
What is the name of the garage that is walkable to PPG Paints Arena?,['Mellon Center garage']
What is the coupon rate for the debt service from 9/1/2025 to 9/1/2042 in the 2023 Bond Issue?,['5.00%']
What is the requirement for a parking facility that uses mechanically issued tickets?,['The ticket ejector must be synchronized with the registering and counting device']
What is the name of the museum's publication that offers monographs or collections of related papers from symposia?,['Bulletin of Carnegie Museum of Natural History']
What is the budgeted amount for Charges for Services revenue in fiscal year 2024?,"['$41,223,252']"
What is the name of the team that is playing against Carnegie Mellon in the women's basketball game on January 26?,['Brandeis']
What is the date when Carnegie Mellon University's men's cross-country team won the Carnegie Mellon Invitational?,['12-Oct-24']
What is the name of the Pittsburgh-based company that produces medical equipment?,['Medrad Inc']
What is the deadline for spending all appropriated funds?,['31-Dec-26']
What is the name of the opera where Pittsburgh Opera will offer free childcare during the matinee?,['La Traviata']
Who is the conductor of the Carnegie Mellon Philharmonic?,['Daniel Nesta Curtis']
What is the name of the opera by Jennifer Higdon?,['Woman With Eyes Closed']
How much was the investment in Station Square?,['$100 million']
What is the total number of Public Sales of City-owned property completed in 2023?,['96']
Who will be the Steelers' kicker in Week 6?,['Chris Boswell']
"What rivers unite at the ""Golden Triangle""?",['Allegheny and Monongahela']
What is the location of the Pause to Relax: Pet Therapy program?,"['Well-being Lab (Room 104), Wellness & Meaning..']"
How many Stanley Cups have the Pittsburgh Penguins won?,['5']
What was the standard spelling of Pittsburgh adopted by?,['United States Board on Geographic Names']
Which job should be considered the principal job when an employee has two part-time jobs with different pay rates?,['The job that pays the most.']
What is the title of the book written by Matthew J.X. Malady?,['Where Yinz At: Why Pennsylvania is the most linguistically rich state in the country']
Who is a founder of the Pittsburgh Cultural Trust?,"['H.J. ""Jack"" Heinz II']"
What is the name of the event at PNC Park on April 6?,['St. Louis Cardinals at Pittsburgh Pirates']
What is the number of participants assisted by The Pittsburgh Partnership in six partnering Neighborhood Employment Centers?,"['2,838']"
"Who wrote the book ""Light in the Darkness: African Americans and the YMCA, 1852-1946""?",['Nina Mjagkij']
"What is the name of the organization that released the ""State of the Air 2011"" report?",['American Lung Association']
What is the name of the event that is not a part of the Architecture Archives exhibition?,['CMU Time Trials']
What is the name of the video production services in Pittsburgh?,"['Post Script Productions, The Videohouse']"
Who founded the H.J. Heinz Company in 1869?,['Henry J. Heinz']
Who won the 2005 Nobel Prize in Physics with Theodor W. Hänsch and Roy J. Glauber?,['John L. Hall']
"When no return was filed, is there a limit to file suit for the collection of taxes?",['No']
What is the amount of Longevity in the Bureau of Environmental Services for Fiscal Year 2024?,"['$65,500']"
How many members are appointed by the Mayor and City Council to the Citizen Police Review Board?,['7']
What is the name of the women's American football team?,['Pittsburgh Passion']
What is the number of bridges in Pittsburgh?,['446']
What is the nickname of Pittsburgh?,"['The Smoky City', 'The City of Champions']"
What is the Black Women's Support Group's schedule?,['5:30 - 7 p.m']
What is the name of the child care center for Carnegie Mellon faculty and staff?,['Cyert Center for Early Education']
"What is the name of the airport that is located in suburban West Mifflin, Pennsylvania?",['Allegheny County Airport']
How many members are in the Pittsburgh City Council?,['Nine']
What is the combined population of the Pittsburgh megaregion in 2016?,"['4,900,000']"
When was the Wagner Act of 1935 passed?,['1935']
What is the name of the stage where Pigeons Playing Ping Pong is performing?,['Stage AE']
What is the principal amount of the debt service for 3/1/2039 in the 2023 Bond Issue?,"['363,625.00']"
Who is the Pittsburgh-based rapper who had a number one hit with 'Black & Yellow'?,['Wiz Khalifa']
What was the name of the book by Joel Tarr?,['The Metabolism of the Industrial City']
What is the average household income in Sewickley Heights?,"['$218,000']"
What is the number of Academy Awards won by Carnegie Mellon University alumni?,['13']
What is the name of the bike-sharing system in Pittsburgh?,['Healthy Ride']
What is the number of staff in the Materials Testing Supervisor position?,"['1\n\nThese pairs cover various topics such as the Department of Mobility and Infrastructure, personnel, and numerical data.']"
What is the name of the university that has a museum of art?,['Indiana University of Pennsylvania']
Where is the Northside Music Festival located?,['Deutschtown']
"What magazine published the article ""Yaeji: All Together Now""?",['Crack Magazine']
How many attendees were hospitalized due to heat exhaustion and other ailments?,['16']
What is the title of the Café Scientifique event?,['Our Fluorinated Fingerprint : Interpreting Patterns of PFAS in Our Environment and Our Bodies']
What airport provides commercial passenger service from over 15 airlines to the Pittsburgh metropolitan area?,['Pittsburgh International Airport']
What is the numerator for the fraction used to compute the tax for a person who discontinues business during any tax quarter?,['The number of days such person was in Business during the current tax quarter']
What award did Mark Malmberg win in 1992?,['Outstanding Individual Achievement in Design']
How long does the Treasurer have to file a suit for the collection of taxes when a return has been filed but no tax paid?,['3 years']
On what date is the performance of Rachmaninoff's Rhapsody at Heinz Hall?,"['Fri, Jan 17, 2025']"
What is the name of the Pittsburgh History Series Teachers' Guide?,"['""Pittsburgh History Series Teachers\' Guide""']"
What is the maximum tax rate on Exempt Performing Arts Productions if the Nonresident Sports Facility Usage Fee is determined to be invalid or not possible to be collected?,['Five percent']
"What is the name of the newspaper that reported ""East Liberty will lose more affordable housing, but seller aims to fight long-term displacement""?",['90.5 WESA']
What is the budgeted amount for Cable Bureau franchise fee in fiscal year 2024?,"['$4,222,332']"
What is the location of the Hunt Institute for Botanical Documentation?,"['5th Fl', '5th Floor']"
What is the total net total of the Frick Park Trust Fund in 2024?,"['$128,775']"
What is the budget for personnel-salaries and wages in the Bureau of Fire for 2024?,"['$74,621,122']"
How many alleyways are being transformed into public art activations in Pittsburgh?,['5']
What is the name of the publication that mentions the Pittsburgh Tea Party?,['Commonwealth Foundation']
"Who is performing at the Cafe at Thunderbird Cafe & Music Hall on Feb 25, 2025?",['Jesse Welles']
What is the anniversary being celebrated by the Architecture Archives?,['40 years']
How often are recycling collections provided for residential properties with five (5) dwelling units or less?,['Bi-weekly']
What is the maximum term of imprisonment for failing to appear before the Treasurer or his agent?,['6 months']
What is the remaining balance for Brighton and Jacksonia signal replacement?,"['195,991']"
What is the location of the CMU Pantry?,"['CMU Pantry', 'Hunt Library, 5th Floor', 'Various locations', 'Nexus of Civic Engagement, Cohon University Center', 'CMU Pantry 2, Hunt Library, Fourth Floor']"
What is the name of the introductory workshop held at the Well-being Lab?,['Inviting Inner Calm with Alexander Technique']
What is the name of the basketball team mentioned in the document?,['Island Rams']
"What was the name of the team that Myron Cope called ""Cincinnati Bungles""?",['Cincinnati Bengals']
What is the name of the sushi restaurant in the arena?,['Nakama']
What is the name of the program area that operates the Roving Art Cart?,['Community Enrichment']
What is the name of the Black Women's Support Group?,"[""Black Women's Support Group""]"
"What is the date of the archived document ""BXA Intercollege Degree Programs – BSA Program""?",['7-Feb-18']
Who is performing at Club Cafe on Nov 17?,['Sam Burchfield']
What year was the first NHL All-Star Game held in Pittsburgh?,['1990']
Who is the Provost of the College of Engineering?,"['James H. Garrett, Jr.']"
When will the Milwaukee Panthers play at Duquesne Dukes Basketball?,['18-Nov-24']
When is the Student Recital of Evelyn Davenport?,['13-Apr']
What is the actual debt service in fiscal year 2023 (projected)?,"['$400,000,000']"
What is the rank of PNC Financial Services in the Fortune 500 list?,['120']
What is the name of the expressway sections of Pennsylvania Route 28 and U.S. Route 22?,['45-mile-long and 70-mile-long expressway sections']
What is the fee for 3 hours parking?,['$3.00']
What is the timeframe for a written request for a refund for amounts paid as a result of a notice asserting or informing a taxpayer of an underpayment?,['1 year']
"Who is the director of the opera ""Alcina""?",['Seamus Ricci']
What is the total amount allocated for ARP Trust Fund Food justice initiatives?,"['$3,000,000']"
"What is the size of the electronic sign ""Sign of Light""?",['20-by-40-foot.']
Who is performing at City Winery Pittsburgh on November 10?,['Jonatha Brooke']
What is the name of the grant awarded to the City in 2023?,['Reconnecting Communities Pilot grant']
What is the name of the program that Carnegie Mellon University has been home to 104 scholars of?,['Fulbright Program']
What is the name of the tailgating zone near the stadium?,['Stage AE Tailgate Zone']
What is the name of the program that offers free concerts?,['Song Shop Concerts']
Who was the Senator from Utah from 1977-2019?,['Orrin Hatch']
In what year did the PCT invite Dutch artist Florentijn Hofman to bring his Rubber Duck sculpture to Pittsburgh?,['2013']
What is the time of the concert of Dervish?,['7:30 PM']
Who is the music director of the Lyric Opera of Chicago?,['Sir Andrew Davis']
When did Little Italy Days move from September to August?,['2013']
"What is the time of the Pittsburgh Symphony Orchestra event on June 8, 2025?",['1:00 PM']
How many venues are participating in Make Music Day Pittsburgh?,['Over 17']
What is the interest rate for late payments?,['1% per month']
What time is the event at Kresge Theatre on February 13?,['7:30 - 9:30 p.m']
What was the name of the high school Myron Cope graduated from?,['Taylor Allderdice High School']
What is the name of the exhibition that includes 43 artworks by 43 artists representing 19 countries?,['17th International Exhibition of Botanical Art & Illustration']
"Who is performing at Heinz Hall on Sun, Feb 23, 2025?",['Ax Plays Mozart']
What was the name of the film that inspired a tradition within the band?,['Monty Python and the Holy Grail']
What is the amount awarded to PA Department of Conservation and Natural Resources for Park Master Plan?,"['$77,547']"
What is the name of the arena where the Pittsburgh Penguins play?,"['Duquesne Gardens', 'Consol Energy Center']"
How many events take place in the Cultural District each year?,"['1,500']"
How often do you need to renew the choice to opt out of data sharing?,['Each time you clear your cookies or use a new browser or device']
What is the name of the country concert itinerary?,['A Country Girl Can Survive']
When will Lang Lang be performing at Heinz Hall?,['MAR 19 2025']
Who is the conductor of the opera Tosca?,['Antony Walker']
What time is the Greg Koch ft. event on November 25?,['7:30 PM']
What is the name of the publication that wrote about the Penguins' disastrous opening night?,['The Athletic']
